tag	commit	parent	stage	status	parameters	training_seconds	advantage	coverage	positive_coverage	rescue	damage	collision	description
rule-accept-all	2702168dea6660611d411c4288a67ae467ea57f0		offline	discard	0	6.704998668283224e-06	-0.01758515139990307	1.0	1.0	21	5	0	Baseline V0.1: accept every original low-progress proposal.
rule-forward	f22aa7eae9521675665b3541da692c904cbbe7e9	rule-accept-all	offline	keep	0	7.194001227617264e-06	0.008015942464377557	0.6413520689836479	0.8998292544109278	21	0	0	Reject holds whose two-second smoothed CV endpoint does not reduce own-goal distance.
rule-cv-clearance	ec7f6f1b0a4f4e96f610cc8ef4cdc33d14aa833d	rule-accept-all	offline	discard	0	7.961993105709553e-06	-0.0220178096375836	0.9267771701982228	0.8764940239043825	5	5	0	Use the unchanged 0.2m margin only as an initiation veto on the two-second CV hold.
rule-forward-cv	378cae73ffa5f0ea3c0db567fcaf2955795caddb	rule-forward	offline	keep	0	7.613038178533316e-06	0.0031112807491827667	0.600084126399916	0.7763232783153102	5	0	0	Combine progress and existing-margin CV feasibility, without fitting thresholds.
linear-advantage	313a8e3b6e7bd393bad3429ca0243a7c6e6b7879	rule-forward	offline	keep	25	0.004300668020732701	0.01103863068268372	0.22704488493962177	0.4365395560614684	21	0	0	Learn delta-Q directly from the fixed lawful features; commit only if predicted advantage is positive.
linear-physical	e39fbb68f5b29dab7866fb1c8e275c4cb7112ece	linear-advantage	offline	keep	11	0.0019403540063649416	0.010353476651091379	0.2445887445887446	0.4657560235249478	21	0	0	Remove critic and observational nuisance features; estimate advantage from hold progress, clearance and motion continuity.
rule-forward	f22aa7eae9521675665b3541da692c904cbbe7e9	rule-accept-all	dev1	discard	0	7.194001227617264e-06	0.0007656602476807661			15	11	2	Reject holds whose two-second smoothed CV endpoint does not reduce own-goal distance.
logistic-utility	a57a97a62883cdd0f19502e8e848ed465b827d1a	linear-advantage	offline	keep	25	0.4902727540466003	0.010109284021660763	0.29917231890916096	0.5304496300512237	20	0	0	Fit the advantage sign with |delta-Q| weights rather than value MSE; zero advantage has zero training weight.
mlp-utility	b629361f510cc4c0d6b9886830b17f41a9112858	logistic-utility	offline	keep	417	0.5384731120429933	0.010992034906831287	0.2692680126890653	0.4907987099222159	21	0	0	Add only nonlinear feature interactions to the same return-weighted logistic objective and inputs.
mlp-advantage	59b9324d0b64027999cec8c44a1b543c8d27f3c2	mlp-utility	offline	discard	417	0.5196833439986221	-0.0019874905788583807	0.3488178488178488	0.34471637260481885	20	2	0	Replace sign-classification loss by episode-balanced delta-Q regression; keep architecture, inputs and compute budget fixed.
mlp-physical	4f9df4063075daec84debc9cd416895dd543983f	mlp-advantage	offline	keep	193	0.5295258470578119	0.006464778034632742	0.2699405857300594	0.4323657749952571	20	0	0	Simplify the fixed regression network to physical/continuity inputs, removing critic-score and observational nuisance correlations.
linear-physical	e39fbb68f5b29dab7866fb1c8e275c4cb7112ece	linear-advantage	dev1	discard	11	0.0019403540063649416	0.0007426159573106217			8	6	2	Remove critic and observational nuisance features; estimate advantage from hold progress, clearance and motion continuity.
mlp-physical-utility	02e10f1c4857c6044e2ac4b45510b72a969f3673	mlp-physical	offline	keep	193	0.5392700809752569	0.006195748549289719	0.24182615629984047	0.40314930753177763	20	0	0	On the same compact inputs, test original-return-weighted decision loss instead of delta-Q MSE.
rule-forward-cv	378cae73ffa5f0ea3c0db567fcaf2955795caddb	rule-forward	dev1	discard	0	7.613038178533316e-06	-0.0004077491912737319			11	9	2	Combine progress and existing-margin CV feasibility, without fitting thresholds.
linear-advantage	313a8e3b6e7bd393bad3429ca0243a7c6e6b7879	rule-forward	dev1	discard	25	0.004300668020732701	0.0007260440829455206			9	7	2	Learn delta-Q directly from the fixed lawful features; commit only if predicted advantage is positive.
logistic-utility	a57a97a62883cdd0f19502e8e848ed465b827d1a	linear-advantage	dev1	discard	25	0.4902727540466003	-2.808231321421717e-05			9	8	2	Fit the advantage sign with |delta-Q| weights rather than value MSE; zero advantage has zero training weight.
mlp-utility	b629361f510cc4c0d6b9886830b17f41a9112858	logistic-utility	dev1	discard	417	0.5384731120429933	0.0033283031284853104			14	6	0	Add only nonlinear feature interactions to the same return-weighted logistic objective and inputs.
mlp-physical	4f9df4063075daec84debc9cd416895dd543983f	mlp-advantage	dev1	keep	193	0.5295258470578119	0.006391390114746043			16	7	-2	Simplify the fixed regression network to physical/continuity inputs, removing critic-score and observational nuisance correlations.
mlp-physical-utility	02e10f1c4857c6044e2ac4b45510b72a969f3673	mlp-physical	dev1	discard	193	0.5392700809752569	0.002970505151147662			9	3	1	On the same compact inputs, test original-return-weighted decision loss instead of delta-Q MSE.
mlp-physical	4f9df4063075daec84debc9cd416895dd543983f	mlp-advantage	dev2	keep	193	0.5295258470578119	0.00077809989296862			10	5	-1	Simplify the fixed regression network to physical/continuity inputs, removing critic-score and observational nuisance correlations.
mlp-physical	4f9df4063075daec84debc9cd416895dd543983f	mlp-advantage	final	discard	193	0.5295258470578119	-0.0024387816443559585			12	13	1	Simplify the fixed regression network to physical/continuity inputs, removing critic-score and observational nuisance correlations.
